{"continuations":[],"parent_manifest_sha256":"89d1fb677212d0555914578c7d1cd626f257e0914ca3961440a941e34dc8769e","run_id":"promax-green-v3-gpt-5-6-sol-a1-f2bde4ebcefa435fbf4be12cf278730b","schema_id":"crossframe.promax.v8.continuation-ledger","schema_version":1,"source_snapshot_sha256":"3186805a3e46e1b16948a4e51d08e7693a8e0dd04aa6b4604e796266d649936c","updated_at":"2026-07-23T01:00:00+08:00"}
