{"continuations":[],"parent_manifest_sha256":"61fe7130feb29789215448d16cad8bccb09b4200d480916f798684895f348a0b","run_id":"promax-run-dd7c57f21d368fd0","schema_id":"crossframe.promax.v8.continuation-ledger","schema_version":1,"source_snapshot_sha256":"3186805a3e46e1b16948a4e51d08e7693a8e0dd04aa6b4604e796266d649936c","updated_at":"2026-07-23T08:54:20Z"}
