{"continuations":[],"parent_manifest_sha256":"a7940ff18e27c20af5709f13efe93fa914b2e350aabab742d592958784254d26","run_id":"promax-green-v4-gpt-5-6-sol-a2-9742973771c64e89813a768c7894faa8","schema_id":"crossframe.promax.v8.continuation-ledger","schema_version":1,"source_snapshot_sha256":"3186805a3e46e1b16948a4e51d08e7693a8e0dd04aa6b4604e796266d649936c","updated_at":"2026-07-23T09:50:00Z"}
